{
  "$schema": "https://json-schema.org/draft/2020-12/schema",
  "title": "Settler Engine Input",
  "type": "object",
  "additionalProperties": false,
  "required": [
    "input_files",
    "input_format",
    "ruleset_path",
    "rounding_mode",
    "timezone",
    "output_dir",
    "mode",
    "determinism"
  ],
  "properties": {
    "input_files": {
      "type": "array",
      "items": { "type": "string" },
      "minItems": 1
    },
    "input_format": {
      "type": "string",
      "enum": ["csv", "json", "auto"],
      "default": "auto"
    },
    "mapping_config_path": {
      "type": ["string", "null"]
    },
    "ruleset_path": { "type": "string" },
    "currency": { "type": ["string", "null"] },
    "rounding_mode": {
      "type": "string",
      "enum": ["bankers", "half_up"],
      "default": "bankers"
    },
    "timezone": {
      "type": "string",
      "default": "UTC"
    },
    "output_dir": { "type": "string" },
    "mode": {
      "type": "string",
      "enum": ["local", "ci"],
      "default": "local"
    },
    "determinism": {
      "type": "object",
      "additionalProperties": false,
      "required": ["sort_keys", "rounding", "timezone"],
      "properties": {
        "sort_keys": {
          "type": "array",
          "items": { "type": "string" }
        },
        "rounding": { "type": "string" },
        "timezone": { "type": "string" }
      }
    }
  }
}
