{
  "input_files": [
    "source_a.csv",
    "source_b.json"
  ],
  "input_format": "auto",
  "ruleset_path": "ruleset.json",
  "rounding_mode": "bankers",
  "timezone": "UTC",
  "output_dir": "out",
  "mode": "local",
  "determinism": {
    "sort_keys": ["key", "source"],
    "rounding": "bankers",
    "timezone": "UTC"
  }
}
